{
  "beds": [
    {
      "bed_id": "BED.FX_SFX",
      "bus_id": "BUS.FX.SFX",
      "confidence": 0.65,
      "content_hint": "fx_bed",
      "intent": {
        "confidence": 0.65,
        "diffuse": 0.75,
        "locks": []
      },
      "kind": "bed",
      "label": "Fx Sfx",
      "notes": [
        "content_hint: fx_bed"
      ],
      "stem_ids": [
        "sfx_stereo"
      ],
      "width_hint": 0.75
    },
    {
      "bed_id": "BED.MUSIC_SYNTH",
      "bus_id": "BUS.MUSIC.SYNTH",
      "confidence": 0.65,
      "content_hint": "pad_texture",
      "intent": {
        "confidence": 0.65,
        "diffuse": 0.85,
        "locks": []
      },
      "kind": "bed",
      "label": "Music Synth",
      "notes": [
        "content_hint: pad_texture"
      ],
      "stem_ids": [
        "pad_stereo_wide"
      ],
      "width_hint": 0.85
    }
  ],
  "generated_utc": "1970-01-01T00:00:00Z",
  "intent": {
    "confidence": 0.0,
    "locks": [],
    "perspective": "audience"
  },
  "metadata": {
    "profile_id": "PROFILE.ASSIST"
  },
  "objects": [
    {
      "azimuth_hint": 0.0,
      "channel_count": 1,
      "confidence": 0.8,
      "depth_hint": 0.25,
      "group_bus": "BUS.BASS",
      "intent": {
        "confidence": 0.8,
        "depth": 0.25,
        "locks": [],
        "position": {
          "azimuth_deg": 0.0
        },
        "width": 0.2
      },
      "label": "bass_di",
      "locks": {
        "azimuth_hint": false,
        "depth_hint": false,
        "width_hint": false
      },
      "notes": [
        "role_id: ROLE.BASS.DI",
        "group_bus: BUS.BASS",
        "classification: close_miked_anchor_object"
      ],
      "object_id": "OBJ.bass_di",
      "role_id": "ROLE.BASS.DI",
      "stem_id": "bass_di",
      "width_hint": 0.2
    },
    {
      "azimuth_hint": 0.0,
      "channel_count": 1,
      "confidence": 0.8,
      "depth_hint": 0.25,
      "group_bus": "BUS.DRUMS",
      "intent": {
        "confidence": 0.8,
        "depth": 0.25,
        "locks": [],
        "position": {
          "azimuth_deg": 0.0
        },
        "width": 0.2
      },
      "label": "kick",
      "locks": {
        "azimuth_hint": false,
        "depth_hint": false,
        "width_hint": false
      },
      "notes": [
        "role_id: ROLE.DRUM.KICK",
        "group_bus: BUS.DRUMS",
        "classification: close_miked_anchor_object"
      ],
      "object_id": "OBJ.kick",
      "role_id": "ROLE.DRUM.KICK",
      "stem_id": "kick",
      "width_hint": 0.2
    }
  ],
  "rules": {
    "layout_safety_defaults": {
      "default_azimuth_mode": "none",
      "prefer_bed_for_ambient": true,
      "unknown_role_strategy": "object_low_confidence"
    },
    "lfe_policy_defaults": {
      "allow_inferred_lfe_send": false,
      "mode": "manual_only"
    }
  },
  "scene_id": "SCENE.BUS.B98EFC52C646",
  "schema_version": "0.1.0",
  "source": {
    "created_from": "draft",
    "stems_dir": "../../../../fixtures/golden/golden_small_stereo"
  },
  "source_refs": {
    "bus_plan_ref": "bus_plan.json",
    "roles_ref": "ontology/roles.yaml",
    "stems_index_ref": "../../../../fixtures/golden/golden_small_stereo/stems_index.json",
    "stems_map_ref": "stems_map.json"
  }
}
